{"schema_name":"artifact-plan","schema_version":"1.0.0","kernel_version":"2.0.0","run_id":"00000000000000000000000000000000","artifacts":[{"logical_id":"run_record","path":"workflow/run.json","schema_name":"run-record","generator":"kernel:init-run","earliest_checkpoint":"run_initialized"},{"logical_id":"artifact_plan","path":"workflow/artifact-plan.json","schema_name":"artifact-plan","generator":"kernel:init-run","earliest_checkpoint":"run_initialized"},{"logical_id":"bootstrap_record","path":"待删除/bootstrap/probe.json","schema_name":"bootstrap-record","generator":"kernel:bootstrap","earliest_checkpoint":"run_initialized"},{"logical_id":"scaffold_contract","path":"workflow/scaffold-contract.json","schema_name":"scaffold-contract","generator":"kernel:init-run","earliest_checkpoint":"run_initialized"},{"logical_id":"scaffold_ledger","path":"workflow/scaffold-ledger.json","schema_name":"scaffold-ledger","generator":"kernel:init-run","earliest_checkpoint":"run_initialized"},{"logical_id":"source_manifest","path":"source/manifest.json","schema_name":"source-manifest","generator":"kernel:verified-import","earliest_checkpoint":"source_ready"}]}
